3	2.865146	10.89.193.181	128.119.245.12	TCP	66	61616 → 80 [FIN, ACK] Seq=1 Ack=1 Win=2055 Len=0 TSval=3682847684 TSecr=1546930124
4	2.866388	10.89.193.181	128.119.245.12	TCP	791	61615 → 80 [PSH, ACK] Seq=1 Ack=1 Win=2058 Len=725 TSval=2884363165 TSecr=1546924740 [TCP segment of a reassembled PDU]
5	2.866485	10.89.193.181	128.119.245.12	TCP	1514	61615 → 80 [ACK] Seq=726 Ack=1 Win=2058 Len=1448 TSval=2884363165 TSecr=1546924740 [TCP segment of a reassembled PDU]
6	2.866486	10.89.193.181	128.119.245.12	TCP	1514	61615 → 80 [ACK] Seq=2174 Ack=1 Win=2058 Len=1448 TSval=2884363165 TSecr=1546924740 [TCP segment of a reassembled PDU]
7	2.866488	10.89.193.181	128.119.245.12	TCP	1514	61615 → 80 [ACK] Seq=3622 Ack=1 Win=2058 Len=1448 TSval=2884363165 TSecr=1546924740 [TCP segment of a reassembled PDU]
8	2.866489	10.89.193.181	128.119.245.12	TCP	1514	61615 → 80 [ACK] Seq=5070 Ack=1 Win=2058 Len=1448 TSval=2884363165 TSecr=1546924740 [TCP segment of a reassembled PDU]
9	2.866490	10.89.193.181	128.119.245.12	TCP	1514	61615 → 80 [ACK] Seq=6518 Ack=1 Win=2058 Len=1448 TSval=2884363165 TSecr=1546924740 [TCP segment of a reassembled PDU]
10	2.866491	10.89.193.181	128.119.245.12	TCP	1514	61615 → 80 [ACK] Seq=7966 Ack=1 Win=2058 Len=1448 TSval=2884363165 TSecr=1546924740 [TCP segment of a reassembled PDU]
11	2.866492	10.89.193.181	128.119.245.12	TCP	1514	61615 → 80 [ACK] Seq=9414 Ack=1 Win=2058 Len=1448 TSval=2884363165 TSecr=1546924740 [TCP segment of a reassembled PDU]
12	2.866493	10.89.193.181	128.119.245.12	TCP	1514	61615 → 80 [ACK] Seq=10862 Ack=1 Win=2058 Len=1448 TSval=2884363165 TSecr=1546924740 [TCP segment of a reassembled PDU]
13	2.866494	10.89.193.181	128.119.245.12	TCP	1514	61615 → 80 [ACK] Seq=12310 Ack=1 Win=2058 Len=1448 TSval=2884363165 TSecr=1546924740 [TCP segment of a reassembled PDU]
21	3.243807	128.119.245.12	10.89.193.181	TCP	66	80 → 61616 [ACK] Seq=1 Ack=2 Win=236 Len=0 TSval=1546950519 TSecr=3682847684
22	3.249878	128.119.245.12	10.89.193.181	TCP	66	80 → 61615 [ACK] Seq=1 Ack=726 Win=238 Len=0 TSval=1546950525 TSecr=2884363165
23	3.249878	128.119.245.12	10.89.193.181	TCP	66	80 → 61615 [ACK] Seq=1 Ack=9414 Win=374 Len=0 TSval=1546950525 TSecr=2884363165
24	3.249879	128.119.245.12	10.89.193.181	TCP	66	80 → 61615 [ACK] Seq=1 Ack=13758 Win=442 Len=0 TSval=1546950525 TSecr=2884363165
25	3.250098	10.89.193.181	128.119.245.12	TCP	1514	61615 → 80 [ACK] Seq=13758 Ack=1 Win=2058 Len=1448 TSval=2884363549 TSecr=1546950525 [TCP segment of a reassembled PDU]
26	3.250299	10.89.193.181	128.119.245.12	TCP	1514	61615 → 80 [ACK] Seq=15206 Ack=1 Win=2058 Len=1448 TSval=2884363549 TSecr=1546950525 [TCP segment of a reassembled PDU]
27	3.250309	10.89.193.181	128.119.245.12	TCP	1514	61615 → 80 [ACK] Seq=16654 Ack=1 Win=2058 Len=1448 TSval=2884363549 TSecr=1546950525 [TCP segment of a reassembled PDU]
28	3.250315	10.89.193.181	128.119.245.12	TCP	1514	61615 → 80 [ACK] Seq=18102 Ack=1 Win=2058 Len=1448 TSval=2884363549 TSecr=1546950525 [TCP segment of a reassembled PDU]
29	3.250318	10.89.193.181	128.119.245.12	TCP	1514	61615 → 80 [ACK] Seq=19550 Ack=1 Win=2058 Len=1448 TSval=2884363549 TSecr=1546950525 [TCP segment of a reassembled PDU]
30	3.250322	10.89.193.181	128.119.245.12	TCP	1514	61615 → 80 [ACK] Seq=20998 Ack=1 Win=2058 Len=1448 TSval=2884363549 TSecr=1546950525 [TCP segment of a reassembled PDU]
31	3.250328	10.89.193.181	128.119.245.12	TCP	1514	61615 → 80 [ACK] Seq=22446 Ack=1 Win=2058 Len=1448 TSval=2884363549 TSecr=1546950525 [TCP segment of a reassembled PDU]
32	3.250334	10.89.193.181	128.119.245.12	TCP	1514	61615 → 80 [ACK] Seq=23894 Ack=1 Win=2058 Len=1448 TSval=2884363549 TSecr=1546950525 [TCP segment of a reassembled PDU]
33	3.250341	10.89.193.181	128.119.245.12	TCP	1514	61615 → 80 [ACK] Seq=25342 Ack=1 Win=2058 Len=1448 TSval=2884363549 TSecr=1546950525 [TCP segment of a reassembled PDU]
34	3.250346	10.89.193.181	128.119.245.12	TCP	1514	61615 → 80 [ACK] Seq=26790 Ack=1 Win=2058 Len=1448 TSval=2884363549 TSecr=1546950525 [TCP segment of a reassembled PDU]
35	3.250349	10.89.193.181	128.119.245.12	TCP	1514	61615 → 80 [ACK] Seq=28238 Ack=1 Win=2058 Len=1448 TSval=2884363549 TSecr=1546950525 [TCP segment of a reassembled PDU]
36	3.250353	10.89.193.181	128.119.245.12	TCP	1514	61615 → 80 [ACK] Seq=29686 Ack=1 Win=2058 Len=1448 TSval=2884363549 TSecr=1546950525 [TCP segment of a reassembled PDU]
37	3.250361	10.89.193.181	128.119.245.12	TCP	1514	61615 → 80 [ACK] Seq=31134 Ack=1 Win=2058 Len=1448 TSval=2884363549 TSecr=1546950525 [TCP segment of a reassembled PDU]
38	3.250448	10.89.193.181	128.119.245.12	TCP	1514	61615 → 80 [ACK] Seq=32582 Ack=1 Win=2058 Len=1448 TSval=2884363549 TSecr=1546950525 [TCP segment of a reassembled PDU]
39	3.250456	10.89.193.181	128.119.245.12	TCP	1514	61615 → 80 [ACK] Seq=34030 Ack=1 Win=2058 Len=1448 TSval=2884363549 TSecr=1546950525 [TCP segment of a reassembled PDU]
40	3.250463	10.89.193.181	128.119.245.12	TCP	1514	61615 → 80 [ACK] Seq=35478 Ack=1 Win=2058 Len=1448 TSval=2884363549 TSecr=1546950525 [TCP segment of a reassembled PDU]
41	3.250467	10.89.193.181	128.119.245.12	TCP	1514	61615 → 80 [ACK] Seq=36926 Ack=1 Win=2058 Len=1448 TSval=2884363549 TSecr=1546950525 [TCP segment of a reassembled PDU]
42	3.250469	10.89.193.181	128.119.245.12	TCP	1514	61615 → 80 [ACK] Seq=38374 Ack=1 Win=2058 Len=1448 TSval=2884363549 TSecr=1546950525 [TCP segment of a reassembled PDU]
43	3.250476	10.89.193.181	128.119.245.12	TCP	1514	61615 → 80 [ACK] Seq=39822 Ack=1 Win=2058 Len=1448 TSval=2884363549 TSecr=1546950525 [TCP segment of a reassembled PDU]
44	3.659595	128.119.245.12	10.89.193.181	TCP	66	80 → 61615 [ACK] Seq=1 Ack=15206 Win=464 Len=0 TSval=1546950904 TSecr=2884363549
45	3.659597	128.119.245.12	10.89.193.181	TCP	66	80 → 61615 [ACK] Seq=1 Ack=22446 Win=577 Len=0 TSval=1546950909 TSecr=2884363549
46	3.659598	128.119.245.12	10.89.193.181	TCP	66	80 → 61615 [ACK] Seq=1 Ack=29686 Win=691 Len=0 TSval=1546950909 TSecr=2884363549
47	3.659598	128.119.245.12	10.89.193.181	TCP	66	80 → 61615 [ACK] Seq=1 Ack=32582 Win=736 Len=0 TSval=1546950909 TSecr=2884363549
48	3.659598	128.119.245.12	10.89.193.181	TCP	66	80 → 61615 [ACK] Seq=1 Ack=36926 Win=804 Len=0 TSval=1546950909 TSecr=2884363549
49	3.659599	128.119.245.12	10.89.193.181	TCP	66	80 → 61615 [ACK] Seq=1 Ack=41270 Win=872 Len=0 TSval=1546950909 TSecr=2884363549
50	3.659977	10.89.193.181	128.119.245.12	TCP	1514	61615 → 80 [ACK] Seq=41270 Ack=1 Win=2058 Len=1448 TSval=2884363958 TSecr=1546950904 [TCP segment of a reassembled PDU]
51	3.659983	10.89.193.181	128.119.245.12	TCP	1514	61615 → 80 [ACK] Seq=42718 Ack=1 Win=2058 Len=1448 TSval=2884363958 TSecr=1546950904 [TCP segment of a reassembled PDU]
52	3.660103	10.89.193.181	128.119.245.12	TCP	1514	61615 → 80 [ACK] Seq=44166 Ack=1 Win=2058 Len=1448 TSval=2884363958 TSecr=1546950909 [TCP segment of a reassembled PDU]
53	3.660104	10.89.193.181	128.119.245.12	TCP	1514	61615 → 80 [ACK] Seq=45614 Ack=1 Win=2058 Len=1448 TSval=2884363958 TSecr=1546950909 [TCP segment of a reassembled PDU]
54	3.660111	10.89.193.181	128.119.245.12	TCP	1514	61615 → 80 [ACK] Seq=47062 Ack=1 Win=2058 Len=1448 TSval=2884363958 TSecr=1546950909 [TCP segment of a reassembled PDU]
55	3.660113	10.89.193.181	128.119.245.12	TCP	1514	61615 → 80 [ACK] Seq=48510 Ack=1 Win=2058 Len=1448 TSval=2884363958 TSecr=1546950909 [TCP segment of a reassembled PDU]
56	3.660123	10.89.193.181	128.119.245.12	TCP	1514	61615 → 80 [ACK] Seq=49958 Ack=1 Win=2058 Len=1448 TSval=2884363958 TSecr=1546950909 [TCP segment of a reassembled PDU]
57	3.660130	10.89.193.181	128.119.245.12	TCP	1514	61615 → 80 [ACK] Seq=51406 Ack=1 Win=2058 Len=1448 TSval=2884363958 TSecr=1546950909 [TCP segment of a reassembled PDU]
58	3.660137	10.89.193.181	128.119.245.12	TCP	1514	61615 → 80 [ACK] Seq=52854 Ack=1 Win=2058 Len=1448 TSval=2884363958 TSecr=1546950909 [TCP segment of a reassembled PDU]
59	3.660142	10.89.193.181	128.119.245.12	TCP	1514	61615 → 80 [ACK] Seq=54302 Ack=1 Win=2058 Len=1448 TSval=2884363958 TSecr=1546950909 [TCP segment of a reassembled PDU]
60	3.660145	10.89.193.181	128.119.245.12	TCP	1514	61615 → 80 [ACK] Seq=55750 Ack=1 Win=2058 Len=1448 TSval=2884363958 TSecr=1546950909 [TCP segment of a reassembled PDU]
61	3.660148	10.89.193.181	128.119.245.12	TCP	1514	61615 → 80 [ACK] Seq=57198 Ack=1 Win=2058 Len=1448 TSval=2884363958 TSecr=1546950909 [TCP segment of a reassembled PDU]
62	3.660233	10.89.193.181	128.119.245.12	TCP	1514	61615 → 80 [ACK] Seq=58646 Ack=1 Win=2058 Len=1448 TSval=2884363958 TSecr=1546950909 [TCP segment of a reassembled PDU]
63	3.660239	10.89.193.181	128.119.245.12	TCP	1514	61615 → 80 [ACK] Seq=60094 Ack=1 Win=2058 Len=1448 TSval=2884363958 TSecr=1546950909 [TCP segment of a reassembled PDU]
64	3.660244	10.89.193.181	128.119.245.12	TCP	1514	61615 → 80 [ACK] Seq=61542 Ack=1 Win=2058 Len=1448 TSval=2884363958 TSecr=1546950909 [TCP segment of a reassembled PDU]
65	3.660253	10.89.193.181	128.119.245.12	TCP	1514	61615 → 80 [ACK] Seq=62990 Ack=1 Win=2058 Len=1448 TSval=2884363958 TSecr=1546950909 [TCP segment of a reassembled PDU]
66	3.660258	10.89.193.181	128.119.245.12	TCP	1514	61615 → 80 [ACK] Seq=64438 Ack=1 Win=2058 Len=1448 TSval=2884363958 TSecr=1546950909 [TCP segment of a reassembled PDU]
67	3.660263	10.89.193.181	128.119.245.12	TCP	1514	61615 → 80 [ACK] Seq=65886 Ack=1 Win=2058 Len=1448 TSval=2884363958 TSecr=1546950909 [TCP segment of a reassembled PDU]
68	3.660267	10.89.193.181	128.119.245.12	TCP	1514	61615 → 80 [ACK] Seq=67334 Ack=1 Win=2058 Len=1448 TSval=2884363958 TSecr=1546950909 [TCP segment of a reassembled PDU]
69	3.660270	10.89.193.181	128.119.245.12	TCP	1514	61615 → 80 [ACK] Seq=68782 Ack=1 Win=2058 Len=1448 TSval=2884363958 TSecr=1546950909 [TCP segment of a reassembled PDU]
70	3.660276	10.89.193.181	128.119.245.12	TCP	1514	61615 → 80 [ACK] Seq=70230 Ack=1 Win=2058 Len=1448 TSval=2884363958 TSecr=1546950909 [TCP segment of a reassembled PDU]
71	3.660279	10.89.193.181	128.119.245.12	TCP	1514	61615 → 80 [ACK] Seq=71678 Ack=1 Win=2058 Len=1448 TSval=2884363958 TSecr=1546950909 [TCP segment of a reassembled PDU]
72	3.660322	10.89.193.181	128.119.245.12	TCP	1514	61615 → 80 [ACK] Seq=73126 Ack=1 Win=2058 Len=1448 TSval=2884363958 TSecr=1546950909 [TCP segment of a reassembled PDU]
73	3.660328	10.89.193.181	128.119.245.12	TCP	1514	61615 → 80 [ACK] Seq=74574 Ack=1 Win=2058 Len=1448 TSval=2884363958 TSecr=1546950909 [TCP segment of a reassembled PDU]
74	3.660331	10.89.193.181	128.119.245.12	TCP	1514	61615 → 80 [ACK] Seq=76022 Ack=1 Win=2058 Len=1448 TSval=2884363958 TSecr=1546950909 [TCP segment of a reassembled PDU]
75	3.660334	10.89.193.181	128.119.245.12	TCP	1514	61615 → 80 [ACK] Seq=77470 Ack=1 Win=2058 Len=1448 TSval=2884363958 TSecr=1546950909 [TCP segment of a reassembled PDU]
76	3.660377	10.89.193.181	128.119.245.12	TCP	1514	61615 → 80 [ACK] Seq=78918 Ack=1 Win=2058 Len=1448 TSval=2884363958 TSecr=1546950909 [TCP segment of a reassembled PDU]
77	3.660384	10.89.193.181	128.119.245.12	TCP	1514	61615 → 80 [ACK] Seq=80366 Ack=1 Win=2058 Len=1448 TSval=2884363958 TSecr=1546950909 [TCP segment of a reassembled PDU]
78	3.660389	10.89.193.181	128.119.245.12	TCP	1514	61615 → 80 [ACK] Seq=81814 Ack=1 Win=2058 Len=1448 TSval=2884363958 TSecr=1546950909 [TCP segment of a reassembled PDU]
79	3.660396	10.89.193.181	128.119.245.12	TCP	1514	61615 → 80 [ACK] Seq=83262 Ack=1 Win=2058 Len=1448 TSval=2884363958 TSecr=1546950909 [TCP segment of a reassembled PDU]
80	3.660401	10.89.193.181	128.119.245.12	TCP	1514	61615 → 80 [ACK] Seq=84710 Ack=1 Win=2058 Len=1448 TSval=2884363958 TSecr=1546950909 [TCP segment of a reassembled PDU]
81	3.660404	10.89.193.181	128.119.245.12	TCP	1514	61615 → 80 [ACK] Seq=86158 Ack=1 Win=2058 Len=1448 TSval=2884363958 TSecr=1546950909 [TCP segment of a reassembled PDU]
82	3.660444	10.89.193.181	128.119.245.12	TCP	1514	61615 → 80 [ACK] Seq=87606 Ack=1 Win=2058 Len=1448 TSval=2884363958 TSecr=1546950909 [TCP segment of a reassembled PDU]
83	3.660451	10.89.193.181	128.119.245.12	TCP	1514	61615 → 80 [ACK] Seq=89054 Ack=1 Win=2058 Len=1448 TSval=2884363958 TSecr=1546950909 [TCP segment of a reassembled PDU]
84	3.660456	10.89.193.181	128.119.245.12	TCP	1514	61615 → 80 [ACK] Seq=90502 Ack=1 Win=2058 Len=1448 TSval=2884363958 TSecr=1546950909 [TCP segment of a reassembled PDU]
85	3.660459	10.89.193.181	128.119.245.12	TCP	1514	61615 → 80 [ACK] Seq=91950 Ack=1 Win=2058 Len=1448 TSval=2884363958 TSecr=1546950909 [TCP segment of a reassembled PDU]
86	3.660463	10.89.193.181	128.119.245.12	TCP	1514	61615 → 80 [ACK] Seq=93398 Ack=1 Win=2058 Len=1448 TSval=2884363958 TSecr=1546950909 [TCP segment of a reassembled PDU]
87	3.660467	10.89.193.181	128.119.245.12	TCP	1514	61615 → 80 [ACK] Seq=94846 Ack=1 Win=2058 Len=1448 TSval=2884363958 TSecr=1546950909 [TCP segment of a reassembled PDU]
88	4.071971	128.119.245.12	10.89.193.181	TCP	66	80 → 61615 [ACK] Seq=1 Ack=44166 Win=917 Len=0 TSval=1546951314 TSecr=2884363958
89	4.071973	128.119.245.12	10.89.193.181	TCP	66	80 → 61615 [ACK] Seq=1 Ack=51406 Win=1030 Len=0 TSval=1546951321 TSecr=2884363958
90	4.071974	128.119.245.12	10.89.193.181	TCP	66	80 → 61615 [ACK] Seq=1 Ack=58646 Win=1143 Len=0 TSval=1546951321 TSecr=2884363958
91	4.071974	128.119.245.12	10.89.193.181	TCP	66	80 → 61615 [ACK] Seq=1 Ack=65886 Win=1256 Len=0 TSval=1546951321 TSecr=2884363958
92	4.071974	128.119.245.12	10.89.193.181	TCP	66	80 → 61615 [ACK] Seq=1 Ack=73126 Win=1369 Len=0 TSval=1546951322 TSecr=2884363958
93	4.071974	128.119.245.12	10.89.193.181	TCP	66	80 → 61615 [ACK] Seq=1 Ack=77470 Win=1419 Len=0 TSval=1546951322 TSecr=2884363958
94	4.071974	128.119.245.12	10.89.193.181	TCP	66	80 → 61615 [ACK] Seq=1 Ack=78918 Win=1432 Len=0 TSval=1546951322 TSecr=2884363958
95	4.071974	128.119.245.12	10.89.193.181	TCP	66	80 → 61615 [ACK] Seq=1 Ack=84710 Win=1411 Len=0 TSval=1546951322 TSecr=2884363958
96	4.071974	128.119.245.12	10.89.193.181	TCP	66	80 → 61615 [ACK] Seq=1 Ack=87606 Win=1426 Len=0 TSval=1546951322 TSecr=2884363958
97	4.071975	128.119.245.12	10.89.193.181	TCP	66	80 → 61615 [ACK] Seq=1 Ack=91950 Win=1403 Len=0 TSval=1546951322 TSecr=2884363958
98	4.071975	128.119.245.12	10.89.193.181	TCP	66	80 → 61615 [ACK] Seq=1 Ack=96294 Win=1419 Len=0 TSval=1546951322 TSecr=2884363958
99	4.072360	10.89.193.181	128.119.245.12	TCP	1514	61615 → 80 [ACK] Seq=96294 Ack=1 Win=2058 Len=1448 TSval=2884364371 TSecr=1546951314 [TCP segment of a reassembled PDU]
100	4.072368	10.89.193.181	128.119.245.12	TCP	1514	61615 → 80 [ACK] Seq=97742 Ack=1 Win=2058 Len=1448 TSval=2884364371 TSecr=1546951314 [TCP segment of a reassembled PDU]
101	4.072376	10.89.193.181	128.119.245.12	TCP	1514	61615 → 80 [ACK] Seq=99190 Ack=1 Win=2058 Len=1448 TSval=2884364371 TSecr=1546951314 [TCP segment of a reassembled PDU]
102	4.072384	10.89.193.181	128.119.245.12	TCP	1514	61615 → 80 [ACK] Seq=100638 Ack=1 Win=2058 Len=1448 TSval=2884364371 TSecr=1546951314 [TCP segment of a reassembled PDU]
103	4.072514	10.89.193.181	128.119.245.12	TCP	1514	61615 → 80 [ACK] Seq=102086 Ack=1 Win=2058 Len=1448 TSval=2884364371 TSecr=1546951321 [TCP segment of a reassembled PDU]
104	4.072519	10.89.193.181	128.119.245.12	TCP	1514	61615 → 80 [ACK] Seq=103534 Ack=1 Win=2058 Len=1448 TSval=2884364371 TSecr=1546951321 [TCP segment of a reassembled PDU]
105	4.072524	10.89.193.181	128.119.245.12	TCP	1514	61615 → 80 [ACK] Seq=104982 Ack=1 Win=2058 Len=1448 TSval=2884364371 TSecr=1546951321 [TCP segment of a reassembled PDU]
106	4.072529	10.89.193.181	128.119.245.12	TCP	1514	61615 → 80 [ACK] Seq=106430 Ack=1 Win=2058 Len=1448 TSval=2884364371 TSecr=1546951321 [TCP segment of a reassembled PDU]
107	4.072535	10.89.193.181	128.119.245.12	TCP	1514	61615 → 80 [ACK] Seq=107878 Ack=1 Win=2058 Len=1448 TSval=2884364371 TSecr=1546951321 [TCP segment of a reassembled PDU]
108	4.072540	10.89.193.181	128.119.245.12	TCP	1514	61615 → 80 [ACK] Seq=109326 Ack=1 Win=2058 Len=1448 TSval=2884364371 TSecr=1546951321 [TCP segment of a reassembled PDU]
109	4.072547	10.89.193.181	128.119.245.12	TCP	1514	61615 → 80 [ACK] Seq=110774 Ack=1 Win=2058 Len=1448 TSval=2884364371 TSecr=1546951321 [TCP segment of a reassembled PDU]
110	4.072553	10.89.193.181	128.119.245.12	TCP	1514	61615 → 80 [ACK] Seq=112222 Ack=1 Win=2058 Len=1448 TSval=2884364371 TSecr=1546951321 [TCP segment of a reassembled PDU]
111	4.072557	10.89.193.181	128.119.245.12	TCP	1514	61615 → 80 [ACK] Seq=113670 Ack=1 Win=2058 Len=1448 TSval=2884364371 TSecr=1546951321 [TCP segment of a reassembled PDU]
112	4.072561	10.89.193.181	128.119.245.12	TCP	1514	61615 → 80 [ACK] Seq=115118 Ack=1 Win=2058 Len=1448 TSval=2884364371 TSecr=1546951321 [TCP segment of a reassembled PDU]
113	4.072625	10.89.193.181	128.119.245.12	TCP	1514	61615 → 80 [ACK] Seq=116566 Ack=1 Win=2058 Len=1448 TSval=2884364371 TSecr=1546951321 [TCP segment of a reassembled PDU]
114	4.072629	10.89.193.181	128.119.245.12	TCP	1514	61615 → 80 [ACK] Seq=118014 Ack=1 Win=2058 Len=1448 TSval=2884364371 TSecr=1546951321 [TCP segment of a reassembled PDU]
115	4.072633	10.89.193.181	128.119.245.12	TCP	1514	61615 → 80 [ACK] Seq=119462 Ack=1 Win=2058 Len=1448 TSval=2884364371 TSecr=1546951321 [TCP segment of a reassembled PDU]
116	4.072639	10.89.193.181	128.119.245.12	TCP	1514	61615 → 80 [ACK] Seq=120910 Ack=1 Win=2058 Len=1448 TSval=2884364371 TSecr=1546951321 [TCP segment of a reassembled PDU]
117	4.072645	10.89.193.181	128.119.245.12	TCP	1514	61615 → 80 [ACK] Seq=122358 Ack=1 Win=2058 Len=1448 TSval=2884364371 TSecr=1546951321 [TCP segment of a reassembled PDU]
118	4.072649	10.89.193.181	128.119.245.12	TCP	1514	61615 → 80 [ACK] Seq=123806 Ack=1 Win=2058 Len=1448 TSval=2884364371 TSecr=1546951321 [TCP segment of a reassembled PDU]
119	4.072654	10.89.193.181	128.119.245.12	TCP	1514	61615 → 80 [ACK] Seq=125254 Ack=1 Win=2058 Len=1448 TSval=2884364371 TSecr=1546951321 [TCP segment of a reassembled PDU]
120	4.072656	10.89.193.181	128.119.245.12	TCP	1514	61615 → 80 [ACK] Seq=126702 Ack=1 Win=2058 Len=1448 TSval=2884364371 TSecr=1546951321 [TCP segment of a reassembled PDU]
121	4.072661	10.89.193.181	128.119.245.12	TCP	1514	61615 → 80 [ACK] Seq=128150 Ack=1 Win=2058 Len=1448 TSval=2884364371 TSecr=1546951321 [TCP segment of a reassembled PDU]
122	4.072663	10.89.193.181	128.119.245.12	TCP	1514	61615 → 80 [ACK] Seq=129598 Ack=1 Win=2058 Len=1448 TSval=2884364371 TSecr=1546951321 [TCP segment of a reassembled PDU]
123	4.072730	10.89.193.181	128.119.245.12	TCP	1514	61615 → 80 [ACK] Seq=131046 Ack=1 Win=2058 Len=1448 TSval=2884364371 TSecr=1546951321 [TCP segment of a reassembled PDU]
124	4.072734	10.89.193.181	128.119.245.12	TCP	1514	61615 → 80 [ACK] Seq=132494 Ack=1 Win=2058 Len=1448 TSval=2884364371 TSecr=1546951321 [TCP segment of a reassembled PDU]
125	4.072737	10.89.193.181	128.119.245.12	TCP	1514	61615 → 80 [ACK] Seq=133942 Ack=1 Win=2058 Len=1448 TSval=2884364371 TSecr=1546951321 [TCP segment of a reassembled PDU]
126	4.072740	10.89.193.181	128.119.245.12	TCP	1514	61615 → 80 [ACK] Seq=135390 Ack=1 Win=2058 Len=1448 TSval=2884364371 TSecr=1546951321 [TCP segment of a reassembled PDU]
127	4.072744	10.89.193.181	128.119.245.12	TCP	1514	61615 → 80 [ACK] Seq=136838 Ack=1 Win=2058 Len=1448 TSval=2884364371 TSecr=1546951321 [TCP segment of a reassembled PDU]
128	4.072749	10.89.193.181	128.119.245.12	TCP	1514	61615 → 80 [ACK] Seq=138286 Ack=1 Win=2058 Len=1448 TSval=2884364371 TSecr=1546951321 [TCP segment of a reassembled PDU]
129	4.072752	10.89.193.181	128.119.245.12	TCP	1514	61615 → 80 [ACK] Seq=139734 Ack=1 Win=2058 Len=1448 TSval=2884364371 TSecr=1546951321 [TCP segment of a reassembled PDU]
130	4.072758	10.89.193.181	128.119.245.12	TCP	1514	61615 → 80 [ACK] Seq=141182 Ack=1 Win=2058 Len=1448 TSval=2884364371 TSecr=1546951321 [TCP segment of a reassembled PDU]
131	4.072762	10.89.193.181	128.119.245.12	TCP	1514	61615 → 80 [ACK] Seq=142630 Ack=1 Win=2058 Len=1448 TSval=2884364371 TSecr=1546951321 [TCP segment of a reassembled PDU]
132	4.072768	10.89.193.181	128.119.245.12	TCP	1514	61615 → 80 [ACK] Seq=144078 Ack=1 Win=2058 Len=1448 TSval=2884364371 TSecr=1546951321 [TCP segment of a reassembled PDU]
133	4.072808	10.89.193.181	128.119.245.12	TCP	1514	61615 → 80 [ACK] Seq=145526 Ack=1 Win=2058 Len=1448 TSval=2884364371 TSecr=1546951322 [TCP segment of a reassembled PDU]
134	4.072813	10.89.193.181	128.119.245.12	TCP	1514	61615 → 80 [ACK] Seq=146974 Ack=1 Win=2058 Len=1448 TSval=2884364371 TSecr=1546951322 [TCP segment of a reassembled PDU]
135	4.072838	10.89.193.181	128.119.245.12	HTTP	1093	POST /wireshark-labs/lab3-1-reply.htm HTTP/1.1  (text/plain)
159	4.451784	128.119.245.12	10.89.193.181	TCP	66	80 → 61615 [ACK] Seq=1 Ack=100638 Win=1419 Len=0 TSval=1546951727 TSecr=2884364371
160	4.451785	128.119.245.12	10.89.193.181	TCP	66	80 → 61615 [ACK] Seq=1 Ack=102086 Win=1454 Len=0 TSval=1546951727 TSecr=2884364371
161	4.459578	128.119.245.12	10.89.193.181	TCP	66	80 → 61615 [ACK] Seq=1 Ack=109326 Win=1567 Len=0 TSval=1546951733 TSecr=2884364371
162	4.459578	128.119.245.12	10.89.193.181	TCP	66	80 → 61615 [ACK] Seq=1 Ack=113670 Win=1635 Len=0 TSval=1546951733 TSecr=2884364371
163	4.459579	128.119.245.12	10.89.193.181	TCP	66	80 → 61615 [ACK] Seq=1 Ack=116566 Win=1680 Len=0 TSval=1546951733 TSecr=2884364371
164	4.459579	128.119.245.12	10.89.193.181	TCP	66	80 → 61615 [ACK] Seq=1 Ack=120910 Win=1748 Len=0 TSval=1546951733 TSecr=2884364371
165	4.459580	128.119.245.12	10.89.193.181	TCP	66	80 → 61615 [ACK] Seq=1 Ack=128150 Win=1861 Len=0 TSval=1546951734 TSecr=2884364371
166	4.459580	128.119.245.12	10.89.193.181	TCP	66	80 → 61615 [ACK] Seq=1 Ack=131046 Win=1907 Len=0 TSval=1546951734 TSecr=2884364371
167	4.459580	128.119.245.12	10.89.193.181	TCP	66	80 → 61615 [ACK] Seq=1 Ack=135390 Win=1975 Len=0 TSval=1546951734 TSecr=2884364371
168	4.459581	128.119.245.12	10.89.193.181	TCP	66	80 → 61615 [ACK] Seq=1 Ack=142630 Win=2088 Len=0 TSval=1546951734 TSecr=2884364371
169	4.459581	128.119.245.12	10.89.193.181	TCP	66	80 → 61615 [ACK] Seq=1 Ack=144078 Win=2110 Len=0 TSval=1546951734 TSecr=2884364371
170	4.459581	128.119.245.12	10.89.193.181	TCP	66	80 → 61615 [ACK] Seq=1 Ack=145526 Win=2127 Len=0 TSval=1546951734 TSecr=2884364371
171	4.459581	128.119.245.12	10.89.193.181	TCP	66	80 → 61615 [ACK] Seq=1 Ack=148422 Win=2127 Len=0 TSval=1546951734 TSecr=2884364371
172	4.459581	128.119.245.12	10.89.193.181	TCP	66	80 → 61615 [ACK] Seq=1 Ack=149449 Win=2127 Len=0 TSval=1546951734 TSecr=2884364371
173	4.459581	128.119.245.12	10.89.193.181	HTTP	843	HTTP/1.1 200 OK  (text/html)
175	4.460248	10.89.193.181	128.119.245.12	TCP	66	61615 → 80 [ACK] Seq=149449 Ack=778 Win=2046 Len=0 TSval=2884364758 TSecr=1546951734